<?xml version="1.0"?>
<names
  xmlns="http://www.wrox.com/name"
  xmlns:xsi="http://www.w3.org/2001/XMLSchema-instance"
  xsi:schemaLocation="http://www.wrox.com/name name10.xsd">
  <name title="Mr.">
    <first>John</first>
    <middle>Fitzgerald</middle>
    <last>Doe</last>
  </name>
  <ageName title="Mr." gender="male">
    <first>Weird</first>
    <middle>Al</middle>
    <last>Yankovic</last>
    <age>41</age>
    <birthdate>1959-10-23T13:56:00.000-08:00</birthdate>
  </ageName>
  <person title="Mrs.">
    <first>Jane</first>
    <middle></middle>
    <last>Doe</last>
  </person>
</names>

